{
  "protocol_version": "0.1",
  "receipt_id": "CEP-EXAMPLE-001",
  "capability_id": "CAP-ASSESSMENT",
  "task": "Evaluate a bounded artifact and produce a structured assessment against declared criteria.",
  "executor": {
    "kind": "agent",
    "name": "example-agent",
    "version": "0.1"
  },
  "acceptance_criteria": [
    "Output is produced in the required structure",
    "Every material claim is linked to inspectable evidence",
    "No private credentials or sensitive source material are included"
  ],
  "evidence": [
    {
      "type": "artifact",
      "ref": "artifacts/example-assessment.md",
      "summary": "Structured assessment artifact"
    },
    {
      "type": "test",
      "ref": "checks/example-validation.txt",
      "summary": "Independent validation of required fields and public-boundary constraints"
    }
  ],
  "evaluation": {
    "evaluator": "independent-test-and-review",
    "outcome": "pass",
    "notes": "All declared acceptance criteria were satisfied by inspectable evidence."
  },
  "promotion": {
    "state": "review_required",
    "reason": "Technical evidence passed; explicit owner/governance promotion remains separate."
  },
  "limitations": [
    "This example demonstrates protocol shape, not a claim of benchmark performance."
  ],
  "created_at": "2026-09-07T20:00:00Z"
}
